Attended,First Name,Last Name,Email,Zip/Postal Code,Organization,Job Title,Registration Time,Source,Please pre-submit any questions for the speakers,Country/Region Name
Yes,Bowie,Cheng,bowieylc@stanford.edu,94040,Stanford University,Postdoc,2025-02-03 16:06:06,,what is the false-positive and false-negative rate?,United States
No,Michelle,Miller,michelle.miller@novartis.com,7963,Novartis,Clinical Development,2025-01-15 15:43:27,natera-email,,United States
No,Matt,Osentoski,matt.osentoski@thermofisher.com,30016,Thermofisher,Sr Manager,2025-01-21 11:03:22,,OK,United States
No,Eleonora,Peerani,eleonora@pearbio.com,W12 0BZ,Pear Bio,Director of Precision Medicine R&D,2025-02-04 04:05:59,,What are the tissue requirements to run the test?,United Kingdom
Yes,Tanmay,Naik,tanmay@advancemedilinks.com,400088,Advance Medilinks Pvt Ltd,Product Manager,2025-01-22 11:32:03,natera-social,,India
